question_id,question_uuid,subject,question,options,correct_answer,llama_answer,llama_explanation,llama_correct,qwen_answer,qwen_explanation,qwen_correct,notes
1,209d2eea-7480-4d81-8907-f906ac8d3b51,college_biology,Short sequence by promoter that assists transcription by interacting with regulatory proteins.,"A: Enhancer 
B: Repressor 
C: Operator 
D: Promoter ",C,A,"The correct answer is A because an enhancer is a short sequence of DNA that assists transcription by interacting with regulatory proteins. Enhancers are typically located far away from the promoter and can be located upstream or downstream of the promoter, but they can also be located on a different chromosome. They work by binding to specific transcription factors, which then interact with the RNA polymerase and other proteins to facilitate the initiation of transcription. This is in contrast to the other options, which are not involved in assisting transcription in this way. Repressors (B) actually inhibit transcription, operators (C) are specific DNA sequences that repressors bind to, and promoters (D) are the sequences that RNA polymerase binds to, but they do not assist transcription in",NO,A,"Enhancers are DNA sequences that can increase the rate of transcription of a gene even when located at a distance from it. They do this by interacting with specific regulatory proteins that assist in transcription initiation. Therefore, the correct answer is A.",NO,
2,5d2d4205-2067-4d4f-becc-3a19e1437bc9,college_biology,"All of the following support the endosymbiotic theory that ancestors of mitochondria and chloroplasts were once independent, free-living prokaryotes EXCEPT:","A: Mitochondria and chloroplasts divide independently of the eukaryotic host cell by a process similar to binary fission. 
B: Mitochondria and chloroplasts have ribosomes that more closely resemble those of bacteria than of eukaryotic cells. 
C: Mitochondria and chloroplasts function independently from the eukaryotic host cell. 
D: Mitochondria, chloroplasts, and bacteria have a single, circular chromosome without histones or proteins. ",C,D,"The correct answer is D because mitochondria and chloroplasts have more complex chromosomes than bacteria. While it is true that mitochondria and chloroplasts have a single, circular chromosome, they also have additional DNA and proteins associated with their chromosomes, such as histone-like proteins, which are not found in bacteria. This suggests that their chromosomes have evolved to be more complex and integrated with the host cell's genetic material, contradicting the idea that they were once independent, free-living prokaryotes.",NO,C,"The endosymbiotic theory posits that mitochondria and chloroplasts were once free-living prokaryotes that were engulfed by a larger cell. This theory is supported by several characteristics, including their ability to divide independently through processes like binary fission (A), their bacterial-like ribosomes (B), and their possession of a single, circular chromosome without histones or proteins (D). However, the fact that mitochondria and chloroplasts function independently from the eukaryotic host cell (C) does not necessarily indicate they were once free-living prokaryotes; rather, it suggests they have evolved to perform specific functions within the host cell. Therefore, option C does not directly support the endosymbiotic theory",YES,
3,779c2bf1-e37d-4db3-8cce-a4377a5c3304,college_biology,A lizard lacking a chemical defense mechanism that is colored in the same way as a lizard that has a defense mechanism is displaying,"A: aposometric coloration. 
B: cryptic coloration. 
C: Batesian mimicry. 
D: Müllerian mimicry. ",C,C,"The lizard lacking a chemical defense mechanism that is colored in the same way as a lizard that has a defense mechanism is displaying a form of mimicry. This is because the lizard without the defense mechanism is mimicking the appearance of the lizard with the defense mechanism, in order to gain protection from predators. This is a classic example of Batesian mimicry, where a harmless species (the lizard without the defense mechanism) mimics the appearance of a harmful species (the lizard with the defense mechanism) to avoid predation.",YES,C,"Batesian mimicry occurs when a harmless species evolves to resemble a harmful or unpalatable species to avoid predation. In this scenario, a lizard lacking a chemical defense mechanism that looks like one with such a mechanism is being protected by the resemblance, which fits the definition of Batesian mimicry.",YES,
4,6db2ea88-4288-4605-b2d8-bb72075680be,college_biology,Which of the following statements is correct?,"A: Water flows from hypertonic to hypotonic. 
B: Germinating seeds use less oxygen than do nongerminating seeds. 
C: The rate of transpiration decreases with an increase in air movement. 
D: Smaller DNA fragments migrate more rapidly than do larger DNA fragments on gel electrophoresis. ",D,D,"The correct answer is D because gel electrophoresis separates DNA fragments based on their size and charge. Smaller DNA fragments have a higher charge-to-mass ratio, which allows them to migrate more rapidly through the gel matrix than larger DNA fragments. This is because smaller fragments have a greater mobility in the electric field, enabling them to move more quickly towards the positive electrode.",YES,D,"Water moves from hypotonic to hypertonic solutions, not the other way around, making statement A incorrect. Germinating seeds typically use more oxygen than non-germinating seeds due to increased metabolic activity, so B is false. Increased air movement actually increases transpiration rates, contradicting C. In gel electrophoresis, smaller DNA fragments have shorter paths to travel and thus move faster, confirming D as the correct statement.",YES,
5,92ef4484-7d36-4d06-9601-137a6cd7ce28,college_biology,"A researcher is experimenting with nerve transmission using neurons from a giant squid. At the beginning of the experiment, the axon is at rest and has a threshold measured at –70 mV at 37oC. The axon receives one stimulus that triggers one action potential in the axon. Subsequent stimuli are much stronger. Which of the following statements explains what happens when several strong stimuli are experienced by the axon?","A: The axon becomes hyperpolarized to –90 mV. 
B: The axon becomes hyperpolarized to –50 mV. 
C: The strength of the action potential becomes greater. 
D: The frequency of the action potential increases. ",D,D,"The correct answer is D because when an axon experiences several strong stimuli, it can lead to a phenomenon called accommodation. Accommodation is a process where the axon becomes less responsive to subsequent stimuli, resulting in an increase in the frequency of action potentials. This is because the axon's threshold for generating an action potential decreases, allowing it to fire more easily in response to stronger stimuli. The other options are incorrect because hyperpolarization (options A and B) would actually make it more difficult for the axon to generate an action potential, and an increase in the strength of the action potential (option C) is not a direct consequence of experiencing multiple strong stimuli.",YES,D,"The frequency of the action potential increases because strong stimuli can cause repetitive firing if the threshold is repeatedly exceeded, leading to more action potentials within a given time frame. Hyperpolarization to –90 mV or –50 mV would indicate a failure to reach the threshold, and an increase in action potential strength is not a typical response to strong stimuli; instead, the neuron may enter a refractory period where it cannot fire again immediately.",YES,
6,e5586971-02b3-432e-a123-896335d90515,college_biology,Darwin's mechanism of natural selection required long time spans in order to modify species. From whom did Darwin get the concept of Earth's ancient age?,"A: Georges Cuvier 
B: Charles Lyell 
C: Alfred Wallace 
D: Thomas Malthus ",B,B,"I chose B because Charles Lyell was a geologist who advocated for the concept of uniformitarianism, which posits that the Earth's geological features were shaped by slow and continuous processes over a long period of time. Lyell's ideas about the Earth's ancient age were influential in shaping Darwin's understanding of the vast time scales required for natural selection to act on species. Darwin's own writings suggest that he was heavily influenced by Lyell's work, and that Lyell's ideas about the Earth's age helped to inform his own thinking about the process of evolution.",YES,B,"Charles Lyell provided Darwin with the concept of Earth's ancient age through his work ""Principles of Geology,"" which emphasized the slow and gradual processes shaping the Earth over vast periods. This understanding was crucial for Darwin to develop his theory of natural selection, as it allowed him to envision the necessary time for species to evolve.",YES,
7,4ca0e901-343d-491e-bfc7-0b7ab9291f8d,college_biology,"The first simple cells evolved approximately 3.5 billion years ago, followed by the more complex eukaryotic cells 2.1 billion years ago. Which of the following statements is correct?","A: Eukaryotic organelles helped create separate environments for metabolic reactions, thus increasing their metabolic efficiency. 
B: Prokaryotic and eukaryotic cells have no structural similarities. 
C: The organelles in larger eukaryotic cells took care of the problems of having a larger surface area–to–volume ratio. 
D: Eukaryotic cells are able to multiply faster based on their more complex structure. ",A,A,"The correct answer is A because eukaryotic cells have organelles that are specialized to perform specific functions, such as mitochondria for energy production and chloroplasts for photosynthesis. These organelles create separate environments for metabolic reactions, allowing for more efficient and controlled processes. This is in contrast to prokaryotic cells, which lack these specialized organelles and have a more diffuse metabolic system.

The other options are incorrect because:

* B is incorrect because prokaryotic and eukaryotic cells do have structural similarities, such as a cell membrane and genetic material.
* C is incorrect because the organelles in eukaryotic cells do not directly address the problem of a larger surface area-to-volume ratio. In",YES,A,"Eukaryotic organelles indeed helped create separate environments for metabolic reactions, which increased their metabolic efficiency. This is because organelles such as mitochondria and chloroplasts perform specific functions that can be optimized within these compartments, leading to enhanced cellular processes. Therefore, option A is correct. Option B is incorrect because prokaryotic and eukaryotic cells share many structural similarities, such as cell membranes and ribosomes. Option C is partially true but does not directly address the evolution from prokaryotic to eukaryotic cells. Option D is not necessarily correct; while complexity can offer advantages, it doesn't inherently mean eukaryotic cells multiply faster than prokaryotic ones.",YES,
8,4e955aa2-8d01-4c54-a358-365c80ebdff1,college_biology,All of the following are stimulated by the sympathetic nervous system EXCEPT,"A: dilation of the pupil of the eye 
B: constriction of blood vessels 
C: increased secretion of the sweat glands 
D: increased peristalsis in the gastrointestinal tract ",D,B,"The sympathetic nervous system is responsible for the ""fight or flight"" response, which prepares the body to respond to stress or emergency situations. This response involves various physiological changes, including increased heart rate, blood pressure, and respiration, as well as dilation of the pupils, increased secretion of sweat glands, and increased blood flow to muscles.

However, constriction of blood vessels is not a typical response of the sympathetic nervous system. In fact, the sympathetic nervous system causes vasodilation, which is the widening of blood vessels, to increase blood flow to muscles and other areas of the body. This is in contrast to vasoconstriction, which is the narrowing of blood vessels, and is typically a response of the parasympathetic nervous system",NO,D,"The sympathetic nervous system generally stimulates responses that prepare the body for stress or ""fight or flight."" It causes dilation of the pupils (A), constricts blood vessels to redirect blood flow (B), and increases sweat gland activity (C) to cool the body. However, it does not increase peristalsis in the gastrointestinal tract; instead, it typically inhibits digestive processes to conserve energy for immediate physical demands. Therefore, the correct answer is D.",YES,
9,68f0e859-4cc0-4ba7-91b5-7d3b64a105aa,college_biology,Which of the following is a frameshift mutation?,"A: CAT HAS HIS → CAT HAS HIT 
B: CAT HAS HIS → CAT HSH ISA 
C: CAT HAS HIS → CAT HIS HAT 
D: CAT HAS HIS → CAT WAS HIT ",B,B,"A frameshift mutation occurs when the addition or deletion of nucleotides in a DNA sequence changes the reading frame of the genetic code, resulting in a completely different amino acid sequence. This type of mutation can be identified by looking for a change in the number of nucleotides that is not a multiple of three, which is the typical number of nucleotides in a codon.

In the given options, option B shows a change from ""CAT HAS HIS"" to ""CAT HSH ISA"". The addition of an extra nucleotide ""H"" in the middle of the sequence changes the reading frame, resulting in a completely different amino acid sequence. This is a classic example of a frameshift mutation.

In contrast, options A, C, and",YES,B,"A frameshift mutation occurs when there is an addition or deletion of one or more nucleotides in the DNA sequence, which changes the reading frame of the genetic code. This results in a completely different sequence of amino acids being produced during protein synthesis, often leading to a non-functional protein.

Option B: ""CAT HAS HIS → CAT HSH ISA"" represents a frameshift mutation because the insertion of ""HIS"" into the original sequence shifts the reading frame, altering the subsequent codons and potentially the entire protein sequence.

Options A, C, and D do not represent frameshift mutations as they either involve substitutions (A and C) or a simple reversal of letters (D), without changing the reading frame.",YES,
10,00879eee-c682-41b2-8e88-a7b222453011,college_biology,This process couples the production of ATP with the movement of electrons down the electron transport chain by harnessing the driving force created by a proton gradient.,"A: Glycolysis 
B: Chemiosmosis 
C: Fermentation 
D: Calvin cycle ",B,B,"The correct answer is B because chemiosmosis is the process by which the energy from a proton gradient is used to produce ATP during cellular respiration. This process specifically involves the movement of electrons down the electron transport chain, which creates a proton gradient across a membrane. The energy from this gradient is then used to drive the production of ATP through the process of chemiosmosis. The other options do not directly involve the production of ATP through the movement of electrons down the electron transport chain.",YES,B,"Chemiosmosis is the process that couples the production of ATP with the movement of electrons down the electron transport chain by harnessing the driving force created by a proton gradient. This mechanism is central to the electron transport chain and oxidative phosphorylation in mitochondria and bacterial cells. Glycolysis and fermentation produce ATP through substrate-level phosphorylation without relying on an electron transport chain or proton gradient. The Calvin cycle is involved in carbon fixation during photosynthesis and does not directly couple ATP production with electron transport. Therefore, the correct answer is B.",YES,
11,0f68d2ad-6f5d-4cdc-bcb4-e457a928a613,college_biology,This biome contains plants whose roots cannot go deep due to the presence of a permafrost.,"A: Desert 
B: Tundra 
C: Taiga 
D: Deciduous forests ",C,B,"The correct answer is B because the tundra biome is characterized by permafrost, which is a layer of soil and rock that remains frozen for two or more consecutive years. This frozen layer prevents plant roots from growing deep into the ground, making it difficult for plants to access water and nutrients. The tundra biome is also known for its low temperatures and short growing season, which further limits the depth of plant roots. In contrast, the other options do not typically have permafrost, and their plant roots can grow deeper into the soil.",NO,B,"B

The tundra biome is characterized by its cold climate and the presence of permafrost, which is permanently frozen subsoil. This condition limits plant root growth to the upper layers of soil that thaws during the short summer season. The other biomes listed do not typically feature permafrost as a defining characteristic.",NO,
12,2f8f2774-cdba-47fe-9f2e-e7bade715918,college_biology,"In plants, the tendency of climbing vines to twine their tendrils around a trellis is called","A: thigmotropism 
B: hydrotropism 
C: phototropism 
D: geotropism ",A,A,"The correct answer is A because thigmotropism refers to the response of plants to touch or contact, which is the mechanism behind climbing vines twining their tendrils around a trellis. This response allows the plant to physically interact with its environment and adapt to its surroundings. The other options are incorrect because hydrotropism is the response to water, phototropism is the response to light, and geotropism is the response to gravity, none of which are directly related to the physical interaction between a plant and a trellis.",YES,A,"Thigmotropism is the growth response of a plant in reaction to physical contact. Climbing vines that twine their tendrils around a trellis exhibit this behavior as they respond to the contact with the support structure. Hydrotropism involves growth towards water, phototropism involves growth towards light, and geotropism involves growth in response to gravity. None of these other responses match the specific behavior described in the question.",YES,
13,434f01e6-50b1-41c8-80a6-70694c952fa3,college_biology,"Females with Turner's syndrome have a high incidence of hemophilia, a recessive, X-linked trait. Based on this information, it can be inferred that females with this condition","A: have an extra X chromosome 
B: have an extra Y chromosome 
C: lack an X chromosome 
D: have red blood cells that clump ",C,C,"The question states that females with Turner's syndrome have a high incidence of hemophilia, a recessive, X-linked trait. This means that the females with Turner's syndrome are more likely to express the trait of hemophilia, which is typically associated with the X chromosome. Since Turner's syndrome is a condition where one of the X chromosomes is missing or partially deleted, it can be inferred that the females with this condition lack an X chromosome. This is because they are more likely to express a recessive X-linked trait, which would not be possible if they had a normal number of X chromosomes.",YES,C,"Females with Turner's syndrome lack an X chromosome, which is why option C is correct. Turner's syndrome occurs when one of the two X chromosomes typically found in females is missing or partially missing. This genetic abnormality affects the development and function of various systems in the body, including the cardiovascular, skeletal, and reproductive systems. The presence of hemophilia, a recessive X-linked trait, further supports the absence of a second X chromosome, as females usually require only one normal allele to express the trait due to their XX genotype.",YES,
14,ced533c5-5745-40e1-a87a-ffae39b2d987,college_biology,"Catastrophism, meaning the regular occurrence of geological or meteorological disturbances (catastrophes), was Cuvier's attempt to explain the existence of","A: evolution. 
B: the fossil record. 
C: uniformitarianism. 
D: the origin of new species. ",B,B,"Cuvier's theory of catastrophism was an attempt to explain the existence of the fossil record, which showed a sudden appearance and disappearance of species. He believed that the Earth's history was marked by periodic catastrophes that caused mass extinctions and the creation of new species. This theory was in contrast to the idea of uniformitarianism, which suggests that the Earth's processes have been constant over time. Cuvier's catastrophism was also not directly related to the concept of evolution, which was not widely accepted at the time, or the origin of new species, which was a separate idea. Therefore, the correct answer is the one that relates to the fossil record.",YES,B,"Cuvier's theory of catastrophism aimed to explain the sudden and extensive changes in the fossil record, which he observed as evidence of past geological disasters. This theory contrasted with uniformitarianism, which posited gradual changes over time. Therefore, the correct answer is B: the fossil record.",YES,
15,d9451c3e-f44f-4c34-a833-8081925bda19,college_biology,Which of the following statements best explains why Mendel's principle of segregation was deemed a law?,"A: Mendel's work with pea plants and his conclusions have been described in many sources. 
B: The patterns of trait inheritance observed in pea plants were repeatedly demonstrated in other eukaryotes. 
C: Chromosomes were found to contain the genetic information for traits. 
D: The discovery of the structure of D N A supported Mendel's observations and laws. ",B,A,"The correct answer is A because the question asks which statement best explains why Mendel's principle of segregation was deemed a law. The principle of segregation is a fundamental concept in genetics that describes how alleles separate from each other during gamete formation. The fact that Mendel's work with pea plants and his conclusions have been described in many sources (option A) suggests that his findings have been widely accepted and verified by the scientific community, which is a key characteristic of a law. This is in contrast to options B, C, and D, which describe subsequent discoveries that supported or explained Mendel's laws, but do not directly address why his principle of segregation was initially deemed a law.",NO,B,"Mendel's principle of segregation was deemed a law because the patterns of trait inheritance he observed in pea plants were repeatedly demonstrated in other eukaryotes. This widespread confirmation across different species provided strong evidence supporting the generality and reliability of Mendel's findings, making his principle a fundamental law in genetics.",YES,
16,f659ee9a-a6d0-426f-aba0-978f84ef5fc7,college_biology,Which statement about the beak size of finches on the island of Daphne Major during prolonged drought is true?,"A: Each bird evolved a deeper, stronger beak as the drought persisted. 
B: Each bird developed a deeper, stronger beak as the drought persisted. 
C: Each bird's survival was strongly influenced by the depth and strength of its beak as the drought persisted. 
D: Each bird that survived the drought produced only offspring with deeper, stronger beaks than seen in the previous generation. ",C,C,"The correct answer is C because the statement accurately describes the relationship between beak size and survival during the drought, as observed by Peter and Rosemary Grant on the island of Daphne Major. The Grants found that birds with deeper, stronger beaks were more likely to survive the drought, as they were better able to crack open tough seeds. This suggests that the depth and strength of a bird's beak had a strong influence on its survival during the drought. The other options are incorrect because they imply a more direct evolutionary change in beak size, which is not what the Grants observed.",YES,C,"The correct answer is C. During prolonged drought conditions, the survival of finches on Daphne Major was indeed strongly influenced by the depth and strength of their beaks. This is because birds with more robust beaks were better able to access and process harder seeds and other food sources that became more prevalent during the drought. This selective pressure led to an increased likelihood of these birds surviving and reproducing, thus passing on their advantageous traits to future generations.",YES,
17,0aa50b48-e611-46a8-9702-7f0db939c17f,college_biology,Imagine an organism whose 2n = 96. Meiosis would leave this organism’s cells with how many chromosomes?,"A: 192 
B: 96 
C: 48 
D: 24 ",C,C,"To solve this problem, we need to understand the process of meiosis and how it affects the number of chromosomes in an organism.

Meiosis is a type of cell division that reduces the number of chromosomes in a cell by half. This is because meiosis involves two successive cell divisions (meiosis I and meiosis II) that each reduce the number of chromosomes by half.

The given equation 2n = 96 tells us that the diploid number of chromosomes (the number of chromosomes in a cell with two sets of chromosomes) is 96. This means that each set of chromosomes has 48 chromosomes (since 96 / 2 = 48).

When meiosis occurs, each set of chromosomes is separated, and the number of chromosomes",YES,C,"Meiosis reduces the chromosome number by half, producing gametes with half the number of chromosomes as the original diploid cell. Since the organism's somatic cells have 96 chromosomes (2n = 96), meiosis will result in cells with 48 chromosomes (n = 48). Therefore, the correct answer is C: 48.",YES,
