question_id,question_uuid,subject,question,options,correct_answer,llama_answer,llama_explanation,llama_correct,qwen_answer,qwen_explanation,qwen_correct,notes
18,919632b4-dcf9-4fb4-8c1c-fc21a08447e0,college_biology,"A certain autosomal recessive trait is expressed in 1% of a population. Assuming that the population is in Hardy-Weinberg equilibrium, what percent of the population are carriers but do not express the trait?","A: 10% 
B: 18% 
C: 27% 
D: 50% ",B,D,"To solve this problem, we need to understand the Hardy-Weinberg equilibrium principle, which states that allele and genotype frequencies in a population will remain constant from generation to generation in the absence of other evolutionary influences.

Let's denote the recessive allele as ""r"" and the dominant allele as ""R"". The frequency of the recessive allele is denoted as ""q"" and the frequency of the dominant allele is denoted as ""p"". Since the population is in Hardy-Weinberg equilibrium, we can use the following equation to relate the frequencies of the alleles:

p^2 + 2pq + q^2 = 1

We are given that the trait is expressed in 1% of the population, which means that",NO,B,"The correct answer is B.

Given that the autosomal recessive trait is expressed in 1% of the population, we denote the frequency of the recessive allele as \( q^2 = 0.01 \). Solving for \( q \), we get \( q = \sqrt{0.01} = 0.1 \). The frequency of the dominant allele \( p \) is then \( 1 - q = 0.9 \).

In Hardy-Weinberg equilibrium, the frequency of heterozygous individuals (carriers) is given by \( 2pq \). Substituting the values, we get \( 2 \times 0.9 \times 0.1 =",YES,
19,545800d2-fbc6-45b1-bc66-fc048f94d014,college_biology,Which of the following statements correctly describes what happens to the preRNA during RNA processing?,"A: Introns are removed in the nucleus. A 5′ cap and the poly-A tail are added after the preRNA leaves the nucleus. 
B: Introns are removed and both a 5′ cap and a poly-A tail are added before the preRNA leaves the nucleus. 
C: Exons are removed and a 5′ cap is added before the preRNA leaves the nucleus. After leaving the nucleus, the poly-A tail is added. 
D: Point mutations are repaired, exons are removed, and both a 5′ cap and a poly-A tail are added before the preRNA leaves the nucleus. ",B,B,"The correct answer is B because it accurately describes the process of RNA processing. During RNA processing, introns (non-coding regions) are removed from the preRNA, and exons (coding regions) are spliced together to form a mature mRNA molecule. Additionally, a 5' cap and a poly-A tail are added to the preRNA before it leaves the nucleus. This process prepares the mRNA for translation into protein. The other options are incorrect because they either incorrectly describe the order of events or include unnecessary steps, such as point mutations being repaired.",YES,B,"The correct answer is B. During RNA processing, introns are spliced out from the preRNA in the nucleus, and both a 5′ cap and a poly-A tail are added to the processed mRNA before it exits the nucleus. This ensures that only mature, functional mRNA molecules leave the nucleus for translation.",YES,
20,e4a38331-094e-4556-bb28-b92b40a6b5e0,college_biology,"The same gene that causes various coat patterns in wild and domesticated cats also causes the cross-eyed condition in these cats, the cross-eyed condition being slightly maladaptive. In a hypothetical environment, the coat pattern that is associated with crossed eyes is highly adaptive, with the result that both the coat pattern and the cross-eyed condition increase in a feline population over time. Which statement is supported by these observations?","A: Evolution is progressive and tends toward a more perfect population. 
B: Phenotype is often the result of compromise. 
C: Natural selection reduces the frequency of maladaptive genes in populations over the course of time. 
D: Polygenic inheritance is generally maladaptive, and should become less common in future generations. ",B,B,"The correct answer is B because the scenario describes a situation where a gene that causes a maladaptive trait (crossed eyes) is also associated with a highly adaptive trait (a specific coat pattern). This suggests that the gene is not solely maladaptive, but rather has a complex effect on the phenotype. The fact that both traits increase in the population over time implies that the benefits of the coat pattern outweigh the costs of the crossed eyes, supporting the idea that phenotype is often the result of compromise between different traits.",YES,C,"Natural selection reduces the frequency of maladaptive genes in populations over the course of time. This observation supports the idea that even if a trait like cross-eyedness is maladaptive in one environment, it can still increase in frequency if it becomes adaptive in another. Over time, as the maladaptive trait is selected against in its original context and adaptive in the new context, its frequency will decrease overall, aligning with the principle stated in option C.",NO,